{
  "schema_version": 1,
  "work_item_id": "inspect-source",
  "attempt": 1,
  "executor_id": "executor-inspect-source-1-b9530574",
  "summary": "Inspected e2e-source.txt and observed the trimmed fixture content exactly.",
  "artifacts": [
    "e2e-source.txt"
  ],
  "evidence": [
    "Inspected relative path: e2e-source.txt",
    "Exact trimmed content: expert-team-e2e-v1",
    "FastCtx read showed line 1 as 'expert-team-e2e-v1' and line 2 blank."
  ],
  "checks": [
    "FastCtx glob found exactly E:/code_space/agent-space/multi-teammates-agents/tests/model-e2e-workspace/e2e-source.txt.",
    "FastCtx read completed successfully and reached end of file; no changes were made."
  ],
  "risks": [],
  "failure": null
}
